text,label
it is time to remove cb from the team somehow screw it rip the band aid off it will sting for a bit but everyone will get over it,anger
unfortunately it will not end there followers of whichever candidate is not elected will throw tantrums no winning this elec,anger
hillaryclinton her team must draw from a hat for daily personality drugged yeller quiet screamer,anger
standing pout face aggravates me every week,anger
i really broke young bull hurt u can tell by how bitter and mad he is,anger
yuuuhh plus clin ep and prevmed ugghhh hahaha bitter,anger
any time a man who got paid to throw temper tantrums speaks up you gotta listen,anger
if he heard my thought on the ether my ex has just posted facebook pic of himself snuggling up with said cats now im just angry,anger
provoke me after letting me down,anger
never be a angry drunk lol yall weirdos just enjoy your time,anger
we still have deaths road rage amp violations on the road despite a widely accepted concept of personal accountability while driving,anger
have a rage rage ep coming out soon i will keep you posted on it youtube youtubegaming rage,anger
officials expressed frustration and outrage over the obama hillary administration s support of the muslim brotherhood,anger
sharif is getting more funnier than day by day laughter challenge kashmir baloch,joy
sharif is getting more funnier than day by day challenge kashmir baloch,joy
love my family so much lucky grateful smartassfamily love,joy
love my family so much lucky grateful smartassfamily hilarious love,joy
liking the optimism,joy
buryprofs dittobistro it was indeed lovely and the team were incredibly attentive and on the ball cheese was a lively gesture,joy
londonnpc you are welcome wordgeek nalso good to put a face to the twitter feed even if it was only a cheery hello,joy
cx most often does not require all that much smile care relate and be helpful thanks lakis court hotel in cyprus,joy
turn in two weeks i am so happy was my darkest year yet i am elated that i survived,joy
indymn i thought the holidays could not get any more cheerful and then i met you thenicebot,joy
for that nice breezy calm sunshine weather autumn,joy
gets better without explanation you just wake up one morning and you re just happy totally and utterly elated,joy
that was hilarious msheatherbates pattonoswalt chrishansen anthonyweiner nyc,joy
reminds me of one of the cheerful witches that looks after aurora in disney s sleeping beauty gbbo,joy
thank you so much for coming to detroit i am going to sob joyful rainbows now brb,joy
far ours greet have raised for hgatchristmas with more to come in sparkling cllrjohnfox,joy
day is what you make of it goals challenges business goals success photographer photography thursdaythoughts,joy
hobbitday nhobbit is give gifts on their birthdays so i am sharing the gift of glee today find something that makes you happy,joy
mick nods i would like that he went back to his food smiling as he finished it,joy
absolutely in love with laurie hernandez she is so adorable and is always so cheerful,joy
he gives a gleeful squeak and wraps around you all mine,joy
we give cheerfully and accept gratefully everyone is blessed maya angelou,joy
new day to live and smile hope all the followers a nice night or day d,joy
peers down at you eyes crinkling with mirth and affection i do love ye so my bonnie belle,joy
gorddownie thehipdotcom it would be tragicallyhip if they can help toysforasmile make hospitalized sick kids smile,joy
great minds think alike rejoice,joy
a thin lipped smile graced glossed lips as she let blues peer over at the woman a constant delight as always,joy
was joyous worried i would be disappointed most definitely was not chickflick giggles comethefuckonbridget,joy
lmao is it that iso slutty hater girl that video was hilarious,joy
good optimism sir,joy
of levity on the baby i want isis give me isis nmom shh nbaby i want isis nwest indian woman she wants what nmom ices,joy
starting my new challenge a glee poll every day,joy
valley wins home competitive cheer invite with a score of dell rapids second at,joy
gives me such an exhilarating feeling i love helping people,joy
hey there phil glutting thank you for following us it is appreciated smile,joy
hey there phil glutting thank you for following us it is appreciated,joy
feels good to get outside for a minute and get some fresh air it is hard to stay cooped up inside all day breezy,joy
feels good to get outside for a minute and get some fresh air it is hard to stay cooped up inside all day,joy
hearty jonza to all my friends and follower,joy
ball watching amp rojo would header was equally dreadful,sadness
season is all i am looking for at this point depressing royals,sadness
i want to do is watch some netflix but i am stuck here in class depressing,sadness
does not possess enough power to deliver you from your affliction,sadness
it was dreadful even after he met the catfish he still thought it was her,sadness
this uni reveal is so depressing i miss stingrays,sadness
just watched me before you and it was seriously one of the most depressing movies of my life,sadness
donaldjtrumpjr is that really all you can offer for those who sacrifice daily to keep you safe kayleighmcenany sad,sadness
hedgehogdylan she would frown a bit folding her arms why is it that every time i am in need of assistance someone expects a lil,sadness
feel like an appendix i do not have a purpose depressed alone lonely broken cry hurt crying life,sadness
angelina jolie can not keep a man no one can today we mourn because love is dead,sadness
you are a thief and a liberal mope investigated by the financial services board for theft of govt retirement funds thief,sadness
shit hurting my heart that is how serious it is,sadness
world has some serious issues we should all go to therapy,sadness
what are you listen to these days nbogum these days i feel gloomy i listen to ccm spiritual song often n nchurch oppa mode,sadness
feel like we lost a family member,sadness
life went from happy to unhappy,sadness
but chronic sadness may mean there are underlying issues than getting sad occassionally over a particular issue mhchat,sadness
i would not mind if it did not you know threaten my job when i disagree puts a damper on things,sadness
included for maximum sadness,sadness
i feel for the conductor tonight he is obviously taken grief over the last few weeks he sounds weary of apologising,sadness
can not wait to go to work tomorrow with a high as fuck fever sarcasm nhopefully i will feel better tomorrow nbut i doubt it pessimism,sadness
author twitter might be the most depressing thing i have ever seen,sadness
of stayed in dubai,sadness
those day when u still did nt know kpop n thinking about how sad your life was without it kpop fan,sadness
for inconsolable oxford academics brussels should just ignore the brexit vote and tell the uk it can not leave the eu ever wah,sadness
app just randomly logged me out as i was writing the last part of my college essay and lost all of it,sadness
rather laugh with the rarest genius in beautiful alliance with his own being where he kept his sadness melancholy,sadness
depressing how despicable trump with no policies campaigning on bigotry amp rancour can be so close evil immoral disaster,sadness
feel like i am drowning depression anxiety falure worthless,fear
get so nervous even thinking about talking to i wanna die,fear
lost my blinders panic,fear
feel like i am drowning depression falure worthless,fear
is the scariest american horror story out of all of them i am gonna have to watch in the daytime frightened,fear
i nearly started crying and having a full on panic attack after tatinof bc of the crowds so i feel him,fear
have to finally tell my therapist about my sexuality last frontier not sure i can do it in the am fear singlegirlproblems,fear
i do not think i have ever moved so fast in a panic in all my life gave me such a fright,fear
bus was in a car crash i am still shaking a bit this week was an absolute horror and this was the icing on the cake terrible,fear
bus was in a car crash i am still shaking a bit this week was an absolute horror and this was the icing on the cake,fear
is fun until im an hour away from the time its due and i still havent finished so i have a panic attack,fear
anxiety is rising tonight and i am not sure why sometimes i wonder if i am a magnet for any free floating anxiety in the universe,fear
not a nervouswreck im a nervous pileup goingcrazy helpme insane antisocial,fear
panic attack from fear of starting new medication,fear
interview in the afternoon nervous ek,fear
am beyond mad that i lost track of a brown spider in my brown carpet where did you go will be sneaking up on me,fear
level,fear
just woke up frm a fucking nightmare,fear
get so much pussy np panic attacks nu uncontrollable anxiety ns suicidal fantasies ns sadness ny yearning for death,fear
properly for the first time on saturday pretty nervous,fear
i am surrounded by those trump voters you are right it is fucking terrifying redstate despair,fear
broken tooth for so long now have abscess need dentist but fear makes it hard for me to and still can not go to dentist,fear
we are in so much trouble i do not think the rev will see the funny side of our project nervous,fear
crying katherine is the only one whos like talking to me during my anxiety attack im gonna faint,fear
been really lonely and your phone keeps blowing up but you just can t pick it up and respond to people anxiety recluse issues,fear
shitting it about this tattoo nervous,fear
out in hives for the first time since college finals anxiety sucks,fear
youtube ni get sick to my stomach everytime i see this video amp for the helicopter crew to make such comments is revolting,fear
am beyond mad that i lost track of a brown spider in my brown carpet where did you go will be sneaking up on me frightened,fear
minutes to perform and i am nervous i wish these noises would stop handicapped annoyed,fear
hate when people say i need to talk to you or we need to talk my anxiety immediately goes up,fear
replied to my comments times now i am shaking omg,fear
stuck in the roof of your house provides amazing view but sheer terror of falling down kinda like life,fear
want saturday to be over but then again i want to do good lsat nervous,fear
not a nervouswreck im a pileup goingcrazy helpme insane antisocial,fear
was literally shaking getting the ekg done lol,fear
thanks ryan amp brad for scary the shit out of us in the first episode do not think my heart will make it through the horrific,fear
operation echoes is gathering momentum tense nervous feelsick excited,fear
okay that jump scared the poop out of me right there bad dog bad total code brown in my favorite pants damnit,fear
i fear for the future of mankind,fear
day of college feeling nervous,fear
might have hysteria i do not kno if it is just anxiety or both need a diagnosis cuz somethin is messed up need ert bu i nvr come out,fear
you made me cry and shake to the point where my parents had to calm me down and give me calming tablets,fear
get some acupuncture today for all my damn anxiety,fear
distraction what is really going on selection election syria terrorism race riots nodapl rape,fear
it would be great but what if the card crashes it is happened to me twice nightmare,fear
now im feeling the worry,fear
feeling you get when you know the information but scared you might do bad on a test collegelife nervous,fear
had a hard time falling a sleep and woke up several times because i was afraid of bugs crawling on me and i ended up waking up with a bite,fear
americans are worried about arab terrorists black americans are fearful of a terrorist in a police uniform on a daily basis,fear
was horrible and it was only half a day,fear
weekly riots and terror attacks dead syrians jews fleeing persecution in europe christian genocide in me,fear
news fam life is still hard and awful depression anxiety atleastihavebuffy,fear
fucking hell mate absolute nightmare,fear
i am surrounded by those trump voters you are right it is fucking terrifying redstate,fear
long fear of havin a shit and a spider crawls up ya bum,fear
a shamefull unequal dangerous and worrying world we live in nowadays terrifying charlotte terrorism shitworldforourkids,fear
thanks ryan amp brad for scary the shit out of us in the first episode do not think my heart will make it through the,fear
start work tmrw yall i am nervous lol,fear
do not know what make pakistan fear more their terrorist or their terrorism terrorstatepak,fear
if this ban goes through it will harm so many people disabled veterans people who have chronicpain anxiety iamkratom,fear
i could convince the rest of my children to go to their fucking preschool and elementary schools with fear of gun violence,fear
had a panic attack when i could not find katrinalaw on twitter turns out my twitter is a jerk i can still see her nyssaalghul panic,fear
this is getting out of hand i am freaked out by this death and i am god mommagrendel intimidation,fear
when all of your devices and teles fail just in time for bake off panic gbbo,fear
like i have had the worst night of sleep ever not great before the london to brighton cycle ride for dmtfyp,fear
you think humans have the sense for recognizing impending doom anxiety,fear
have to finally tell my therapist about my sexuality last frontier not sure i can do it in the am singlegirlproblems,fear
literally shaking bc im nervous and bc its fucking cold oh how i love life,fear
feel horrible i have accounting today but physically and mentally am not okay,fear
nlikewise death cutting despair,fear
am about to be a coward and i feel terrible but i can not even face this,fear
okay that jump scared the poop out of me right there bad dog bad total code brown in my favorite pants damnit horror,fear
bbcnews i would rather leave my child with borisjohnson shudder,fear
is this a bridge if i have to drive on such i will stop breathing yooo i can not i am to afraid,fear
roommate talks and laughs in her sleep it never fails to scare the shit out of me,fear
had a dream that i dropped my iphone and it broke t t cry,fear
just deleted my save file trying to load it up now i have to start all over again i am going to freaking kill someone pray for me,fear
omg that is just horrific something needs to be done,fear
getting so nervous for my first anatomy exam,fear
the fact that youre nervous makes me want to crawl in a hole,fear
nothing like a good old fashioned panic induced cry on your living room floor,fear
u scared to present in front of the class severe anxiety whats that r u sad sometimes go get ur depression checked out imediately,fear
this is getting out of hand i am freaked out by this death and i am god mommagrendel,fear
bangladesh war us almost bombed us had russia not been there what strategy for china on pakistan time ripe to crush terror camps,fear
have another test tonight nervous,fear
thedailyshow jordanklepper these interviews scare the crap out of me i never imagined so many dumb dumb americans,fear
believe how nervous i feel tonight who feels the same mufc,fear
was there a clown in your neighborhood creepy enoughisenough,fear
was there a clown in your neighborhood nightmare creepy enoughisenough,fear
hell pam calm yourself down but could have sworn something black amp hairy just ran across the carpet perilsoflivingalone,fear
was so posh it frightened me i am still scared,fear
wake of fresh terror threat and sounding of alert in mumbai praying for safety amp security of everybody in the city maharashtra news,fear
by nightmare could not sleep any more so took a useallthehotwatershower now i have time to read,fear
ughh i just want all this to be over it is like a nightmare can we all just get along,fear
seem to alternate between isleep full and sleepless nights tonight is a sleepless one insomnia anxiety notfair,fear
carr makes me want to cry and cry shiver,fear
my dream they were trying to steal my kidney nightmare blackmarket whydidiwatchthat,fear
carr makes me want to cry and cry shiver awful,fear
forced into a fake hug by someone who didn t flinch to get litigious with you in the past awful,fear
it pisses me off more they killed people who surrendered hands up and all if hands visible you should not be fearing for your life,fear
hands start shaking and he says i hope i die like right now,fear
dread this drive every wednesday,fear
country that gave safe house to osama bin laden is dangerous if not contained pakistan is a terror heaven declare so bankimoon amdg,fear
samheughan can send me good luck on my job interview tomorrow nervous,fear
that is what i am afraid of,fear
not pumped for this interview nervous,fear
amityaffliction kind of drive home from work today nightmare dailyfeels,fear
scared that my coworkers are going to submit me to one of those wardrobe makeover shows fear fashion,fear
you wake up scroll through social media and another father was taken from his child nightmare everyday keithlamontscott,fear
my names anxiety and i have shaun,fear
suffered a bit at times of stress always a bit shy about years ago aged i was made redundant that is when it started,fear
data stolen in and only now do you tell us,fear
dread math,fear
i could pop round nightmare,fear
i am very shy irl and lately i feel like everyone is doing their own thing and i do not fit in anywhere and i feel lonely,fear
do you ever stop being afraid of someone that you live with,fear
i despair at this madness it is beyond shocking it is cold blooded murder how long will southafrica stand by amp watch worldrhinoday,fear
my dream they were trying to steal my kidney blackmarket whydidiwatchthat,fear
she goes first she gets her book signed amp i can barely take their picture cuz i am shaking,fear
had to reverse half way up the woods to collect the dog n i have never even reverse parked in my life nightmare,fear
distraction what is really going on selection election syria race riots nodapl rape,fear
this is flipping great flipping standstill on the freeway anxiety stepofftheledge youvegottobekiddingme,fear
you arrive at the office the day before your first ever festival and the internet is down panic,fear
are you guys still down when can we go up panic,fear
focal points of war lie in terrorism and the un needs to address violentextremism,fear
and despair feeling i look at self and my family hubby fought years for this country i have worked years for this govt gt,fear
my passport in a safe back after getting back from australia only problem is now i can not remember where the safe is panic,fear
lydiaaaa we were the only ones that were supposed to know that you make me nervous,fear
guardian because there is a realistic probability that a clown might be their next president clown uspol nightmare,fear
the fuck is he even doing he should be off that is fucking horrific,fear
i am still too nervous to try it i need to man up and give it ago,fear
breitbartnews if people are in a country of million you are going to ruin the whole country over people fear,fear
zionist terror nimagine this kid was a palestinian or muslim nzionists stealing innocence of childhood from jewish children,fear
do not know how people can binge watch horror films alone,fear
gotten one hour of sleep today is going to be a fun day restless,fear
is the scariest american horror story out of all of them i am gonna have to watch in the daytime,fear
right of reply at unga pakistan preaching of human rights is by a country which is itself the global epicentre of terrorism,fear
boyfriend once forcibly stopped all of my anxiety coping methods at once holding me forcing my hands down that kinda stuff and i,fear
thought the nausea and headaches had passed but lol i feel awful today,fear
interview in the afternoon ek,fear
is the day i cut and dye my hair nervous excited,fear
lysol can got stuck in spray position and we are all slowly suffocating from the trash can that smells like a febreeze factory panic,fear
isis references scrubbed federal complaint against suspect in nyc nj bombings appears to omit terror names in bloody journ news,fear
car rental you have made realize why i always use nationalcares what a nightmare disgusted,fear
for what pro and academic writers have to say about writing anxiety and writersblock,fear
an actual nightmare,fear
we go back weeks and start again this is seriously dreadful,fear
absolutely love having an anxiety attack halfway through a family meal,fear
is the biggest victim of terrorism nawaz sharif nreally it should have been biggest creator of terrorism unga,fear
terror our leaders say wouldo not jump to conclusions but in matters of racial unrest they are silent why is that greggutfeld,fear
tired of people telling me the worry about me when in fact they probably never gave a fuck about me,fear
city is burning the head of terrorism assad regime amp russia are bombarding the city right now with whitephosphrus bombs,fear
hell pam calm yourself down but could have sworn something black amp hairy just ran across the carpet perilsoflivingalone nervous,fear
like nothis is better in the moment cuz i panic and then later its so obviously not better at every opportunity i choose to make it seem,fear
heard what happen at grandad hometown last night such a terrible news hope everyone okay,fear
reality in the form of endless tragedies she did not know how to react at first being too frightened to repeat another,fear
i am hungry but there is no food panic,fear
have a job interview with barclaysuk in loughborough next month nervous,fear
proof spaitogaming every horror movie that frightened me as a child i e it halloween movies all of them nightmare on,fear
butter up the walls nightmare,fear
afraid of all the same things,fear
is on pakistan meaindia after uri terror attack,fear
wanna really go out but i can not say no deffo have a fear of missing out,fear
threat global stability climatechange food water security terrorism russia war trump clinton geopolitics korea vwo,fear
it would be great but what if the card crashes it is happened to me twice,fear
doctor is giving me flower extract to relieve anxiety and reduce panic attacks,fear
get soooo nervous when an actually attractive guy tries to talk to me in person like i turn him down just from habit,fear
we should be ignoring these rioters like the current administration ignores terrorism this will obviously make it stop,fear
okay dont worry i wish i would been a better kid i am trying to slow down i am sorry for letting you down,fear
indian army crossed loc into pok to bust terror camp on sept night,fear
rosie these horrific situations will only get worse if trump is elected vote hillary,fear
scared of their own horror story they wrote afraid of the terror they spread will europe start in anniversary of,fear
husband lost when he booked an apartment through airbnb that did not exist airbnbhelp did not care nightmare airbnbnightmare,fear
issue with that is will the effort involved get back the amount i put into it that is what i am fearful of,fear
fears only makes them scarier whatever your fear if you face it it should start to fade courage,fear
anxiety is playing around help,fear
to be up in hours to go back to work cantsleep excited nervous,fear
husband lost when he booked an apartment through airbnb that did not exist airbnbhelp did not care airbnbnightmare,fear
is going to be a challenge i have to talk at a freshers fair to strangers and pick up my new flat keys anxiety,fear
afraid she is the goat you libeling people afraid goat libeling,fear
bbcquestiontime jacobreesmogg leicesterliz normanlamb carolinelucas oh god not brewer again the horror the horror,fear
too much clutter in my brain with recent little changes that i have not yet processed dying panic ivebeenbusierwhyamioverwhelmed,fear
more videos panicatthedisco post the more i am convinced i might should not have done that fear brendonati,fear
wake me when therealkiss make remix of why b w terrencecrutcher colinkapernick terrorism riots this,fear
championsfight think shes afraid to fight holly one can only imagine what goes through her head when she thinks of cyborg,fear
had a dream that i dropped my iphone and it broke t t cry nightmare,fear
worst than going to the morgue to do a positive id horrible reuters,fear
dann injured aka my worst nightmare,fear
news fam life is still hard and awful depression atleastihavebuffy,fear
day tomorrow for pizza express nervous,fear
in the glove box is pure panic excuse gbbo,fear
to god do not get a smart meter from your power company months of daft bills visits from british gas nightmare stressed,fear
had a panic attack when i could not find katrinalaw on twitter turns out my twitter is a jerk i can still see her nyssaalghul,fear
maybe it was with you and your parents that i would understand you and your fear of indifference from your own mom and dad,fear
interview went well today i can not wait to find out what happens nervous excited interview jobinterview,fear
used to bears i am used to coyotes i love the idea of wolves but this is hard i do not want to be fearful of the meadow or the pines,fear
wellweds siggyflicker whispernghope mcrichard awe i feel so bad being naive ou is the worst,fear
alone is better than being lonely know what is worse than being lonely being empty that is right n loneliness aloneinthecity,fear
can never find the exact emoji that i am after at the exact moment that i need it panic,fear
which one the one where u threaten violence or the phedophiliac u support or the constitution violations he proposes,fear
shaking though,fear
it follows this is a super freaky movie horror scary,fear
paranormal activity the ghost dimension i am not sure how i feel about it yet horror,fear
death is unreliable instead of zero it may be some ghastly hallucination such as the square root of minus one samuel beckett,fear
theaterofscifi thanks nightmare,fear
