text,label
that rutgers game was an abomination an affront to god and man we must never speak of it again,anger
i get mad over something so minuscule i try to ruin somebodies life not like lose your job like get you into federal prison,anger
i get mad over something so minuscule i try to ruin somebodies life not like lose your job like get you into federal prison anger,anger
eyes have been dilated i hate the world right now with the rage of a thousand fiery dragons i need a drink,anger
one chosen by the clp members mp seats are not for people to dole out to their mates we elect candidates fuming,anger
can you please not have canadian players play us players that lag is atrocious fixthisgame trash sfvrefund,anger
i love how theres no outrage that it is a white man but if it was a black man them blm would be all over it regardless of reason,anger
it me or is ding wearing the look of a man who is just found his arch enemy in bed with his missus angryman,anger
i fuck with madden way harder,anger
when guys cant control their anger,anger
fuming fuck sake,anger
frustration looking up at elphaba in a frown of aggravation her high pitched voice was growing more and more,anger
daraidernation erockhd take out of it the numbers on madden are low and have dropped and people are unhappy,anger
dhodgs i will fight this guy do not insult the lions like that but seriously they kinda are wasted some of the best players,anger
brian does is sleep and aggravate me,anger
indianexpress so in your opinion is this the worst delhi govt acrid bitter hypocrisy,anger
indianexpress so in your opinion is this the worst delhi govt acrid hypocrisy,anger
b er off ncfc is a grudge match,anger
to the girl that just hit my car not only did she get lucky w no scratch but also from being spared the wrath of sleep deprived kait,anger
scrubbed hands times before trying to put them in neyeballs burning n evenmoreblind accidentally scared the cat whilst screeching,anger
joined pottermore and was sorted into hufflepuff fuming,anger
no no i insist that you give me your best insult first,anger
coincidentally watched ulzana is raid last night brutally indignant filmmaking,anger
kennycoble saddest part of this whole mess is that all of this anger is misdirected they should march the whitehouse,anger
to self stop laughing at things that offend you it is ok to get mad at people n notetoself offended mad upset,anger
to have vanity sizes now sizes s xs evenxxs sometimes are too big wtf dear corporate jerks lithuania did not need this rant angry,anger
to have vanity sizes now sizes s xs evenxxs sometimes are too big wtf dear corporate jerks lithuania did not need this rant,anger
i spend even minutes with you and you already irritate me i seriously will bitch you out until you shut up,anger
seeing alex revells face gets me angry,anger
spent months arranging swap new jobs etc now i have found out she is been leading me on a merry dance fuming with her,anger
event started everyone is getting ready to travel to the lake of rage where everything glows,anger
paget old in scotland the right wingers are the most rabid anti nationalists socialists are mostly in favour,anger
people will always get offended everyone is situation is different just because we have kids does not mean we have to settle,anger
i try not to let my anger seep into reviews but i resent having my time wasted on books like that time is precious,anger
little things like that make me so angry x,anger
sucks depression,sadness
worthless as always depression,sadness
worthless as always,sadness
fibromyalgia has been really bad lately which is not good for my mental state i feel very overwhelmed anxiety bipolar depression,sadness
think ima lay in bed all day and sulk life is hitting me to hard rn,sadness
when i try i fail and when i do not try i still fail confused and lost,sadness
sadness,sadness
life in one word is depressing,sadness
attacks are the worst feeling really sick and still shaking i should be a sleep anxiety depression,sadness
so grim ugly atm,sadness
depression is kicking my ass lately,sadness
my age all i see is gray is it gray because of my bad eyes or my perspective depression healingjustice,sadness
idk why i start feeling so depress sad and lonely,sadness
sulk too much for my own good,sadness
night where depression is winning depression fml help,sadness
home is depressing,sadness
can not even grieve over one black body before another one pops up due to pig brutality,sadness
a gloomy ass day,sadness
wow i am just really sadden by that terrible,sadness
heads still in ibiza but my body is sat at me desk at work depressing,sadness
do not leave me sad,sadness
sucks,sadness
been a week of awful connectivity with tmobile no service or only is not what im paying for unhappy poorservice,sadness
the most depressing shit ever,sadness
the worst place you can be is in your own head n n quotes worstenemy depression thinktoomuch,sadness
my service is down in cleveland oh what is going on unhappy,sadness
a sad evening clearing out all of harvey is cage and belongings now so final goodbye my little man depressing,sadness
you have doe run the opposite side of you depression,sadness
moment of the day when you have to start to plaster a smile in your face depression,sadness
hate when it is gloomy outside because it always gets me in a depressing mood,sadness
stealing things from my work out quite the damper on my day so now i am going to wear pajamas all day,sadness
ring ring depression is here,sadness
now september and we are still battling a situation that was said to be handled march of this year att this is unacceptable unhappy,sadness
yeah i am sure it will it is just so depressing having to talk to my parents over the phone instead of talking to them downstairs,sadness
at home sick the blues will not cure it so i need ideas sorethroat sick blues music fallweather carletonuniversity ottawa,sadness
would not wish anxiety and depression even on the worst of people it is not fun anxiety depression,sadness
main twitter im in depress,sadness
i am surrounded by those trump voters you are right it is fucking terrifying redstate despair,sadness
to the funeral tomorrow at to mourn the death of my gpa,sadness
jesus you just made think that of all the vols v fl games i have seen i have never seen a win depression,sadness
spending debenhams i was offered a voucher i asked if i could spend it at weekend was told no valid today only unhappy,sadness
i had a pretty solid gpa as a kin major and now that i look at the average for dpt programs i feel even more discouraged,sadness
,sadness
a nsaddened heart nso far amp nyet so near nthe years so ntough amp scarred nthis lonesome nroad nstill feared depression n n poetry poem,sadness
officially ends today sadness,sadness
my evaluation came back and i am minimally effective student test scores on the parcc sunk my eval it is time for me to quit teaching,sadness
news fam life is still hard and awful depression anxiety atleastihavebuffy,sadness
i should just get over my depression and be happy do not you think i have tried that thousands of times already you are not helping,sadness
really constipated this is depressing,sadness
health insurance will not cover tms but they let me know they cover ect mentalhealth psychology depression tms ect,sadness
between hope and despair the day after meetingmyabuserincourt n dvsurvivor,sadness
doge e fresh i am despondent,sadness
applications for my dbs and still waiting been over a year now going to loose my job govuk thanks unhappy crb,sadness
miss when social media was a place to get laughs off and jump in dms lol shit is depressing now,sadness
the three r is depress me,sadness
many gloomy days,sadness
weather sure matches the mood in this state today gloomy,sadness
again dirty and self loathing attitude mope talking,sadness
all black tomorrow as i continue to mourn the lives of the most recent victims of police brutality blackout wu,sadness
i the only person who dislikes fall firstdayoffall leaves thingsdie depressing cold noflipflops,sadness
soul is weary of fighting the battles in this world blackinamerica wearenotsafe,sadness
prayers are with the family friends amp members of vcfd as you mourn the loss of engineer ryan osler lodd rip,sadness
wish i was appreciated for all i do when is it my turn to be taken care of i want a break tired,sadness
though lately with how bad my depression has been i feel like my body is like just taking what little it can get,sadness
have left maine sadness,sadness
fucking sad when the person you love does not try fighting for your happiness when you would do anything for them,sadness
charlotteprotest do u wait the facts video or do u hate now ask questions later sad protest policeshootings suggestions,sadness
interesting the photo of mono lisa is crying as well as the whole scene is very depressing,sadness
news is disheartening everything that is going on is a result of a lack of understanding and misinformation by the media sadness,sadness
ever been this unhappy before in my life lmao,sadness
worst possible decision i could have made when arriving in the uk shocking service poor coverage unhappy,sadness
to the jc and the georges family sad,sadness
one wants to win the wild card because you have to play the cubs on the road sadness,sadness
gloom,sadness
do not think i can go to work tomorrow since val has left gbbo i need a day to mourn,sadness
morning lovely people not gonna lie i have woken up feeling pretty glum,sadness
i can not help but feel melancholic,sadness
lraitt horrid disease my maternal grandmother and each of her sisters suffered from this affliction it is hard on all,sadness
anybody needs me i will be drowning my blues in a sea of whiskey,sadness
magstogether my god is jeremycorbyn a full shilling seriously you need a major rethink or no lab gove in your lifetime sad,sadness
health we did a think about depression and now i feel like i have it,sadness
kellee ii seattlepi even hard facts do not seem to be sinking in i despair,sadness
depressing that it is darker so much earlier now,sadness
chrisbosh n to good hearts i lost my job i am responsible families my information in profile even dollar if can t just re tweet,sadness
unfollowing anything relating to disneyworld or florida holidayblues depressing wantogoback,sadness
just begun ladies and gents the war on racism has begun sadness segregation continues smh,sadness
wish i was appreciated for all i do when is it my turn to be taken care of i want a break tired lost,sadness
mary berry mel and sue have gone with their principles and paulhollywood has gone with the fame and fortune gbbo depressing,sadness
it is super sad especially when you are talking to a real person and not a bot makes it feel real,sadness
call me now i am laying in my bed moping like i intend to do for the next months,sadness
sad song prefect night feeling alone,sadness
so gloomy today,sadness
i have come to a place where i keep getting discouraged but just gotta tell myself to keep pushing through it,sadness
kotakbankltd udaykotak official got in touch issue not addressed unhappy patheticservices,sadness
in cardiff after an amazing days away depressing,sadness
lost i am faded,sadness
the worst place you can be is in your own head n n quotes worstenemy thinktoomuch,sadness
just came of at ortambo int at least passengers with broken bags this was a new suitcase unhappy customer,sadness
me how i am supposed to feel broken hateful guilty love sadness,sadness
will be the last episode of despair arc so much shit is gonna happen i am not emotionally prepared,sadness
then maybe we should keep our white mouths shut and let the people being targeted speak and mourn,sadness
cum and despair,sadness
say it again if i was a black man id be afraid to leave my house or have a moving violation n n terrancecrutcher truth sad,sadness
is sad,sadness
pop some pills sedate myself and wake up tomorrow,sadness
seems so sad she stamped and ran behind the sofa we will have to give her plenty of love and affection more than usual sad,sadness
feels like there are no houses out there for us with the most basic requirements i have there are literally no options discouraged,sadness
wanna go to work but i want the money sad,sadness
the denver housing market is depressing no places to buy in my range fml,sadness
ep of despair arc made me happy but and then i am going back to future arc and i am upset again,sadness
have not nap for days in a row i am very unhappy rn,sadness
literally was gloomy for an hour,sadness
do we think the swallows and swifts have gone photo would nights ago not seen since sad autumn,sadness
gutted disheartened amp so pissed off gone from off the toughest most resolute defences to the worst amp most shambolic scfc stohul,sadness
stop do not make me laugh when i am being sad,sadness
to the jc and the georges family,sadness
your ux online is appalling no clear save button not being able to use any generic tld is unhappy,sadness
being here makes me depress tbh,sadness
the ravallirepublic had a good one but then the reporter quit sad,sadness
room is rather dreary but we endure what we must,sadness
broken hearted lovers do cry away their gloom,sadness
grim amp compelling news report by nawalf on the blockade of aid to the starving in yemen bbc dosomethingpoliticans,sadness
lost my xt nova around hole or sadness,sadness
when you click over and over again for a cupcake but there are no vehicles available sadness,sadness
nasty chilly rain has put a damper on my afternoon cigar this is not a good thing cspanwj and four congresscritters tomorrow,sadness
got diagnosed with severe extreme depression and i did not know there was a difference between those two lol,sadness
haiku n nthe crisp autumn air nmy freedom purchased through death nno one will mourn me,sadness
dad is sad,sadness
as a whole are for the most part feeling borderline despair at the very least looking at a situation out of control,sadness
story of my life lost,sadness
will the weeks full of mondays end disheartened,sadness
i am distraught candice and her pout can piss off,sadness
i do not know whether to despair or agitate for a cull,sadness
i just sulk in peace,sadness
sad when your man leaves work a little bit late and your worst fear is oh no did he get stopped by the police sad ourworld,sadness
car is dented from the hail sad,sadness
my head to think it was better but obviously it is not relapse sadness sickness madness misunderstanding,sadness
i was in high school and remember helping neighbors clean up back home in greenville pretty sobering stuff sadness,sadness
have sleep cooties ni close my eyes and dream that i am awake weary sleepissues narcolepsy,sadness
almost all the t mobile stores in san diego are out of replacements sadness i need to get mine replaced,sadness
forgot my hair straightner home i am feeling lost without it lost lostwithoutmyhairstraightener,sadness
i will not even get started with hillary and her fancy fundraisers depressing,sadness
underground at waterloo is not a nice place to be at on a thursday somanypeople grim,sadness
will the weeks full of mondays end,sadness
ew omg that is so grim,sadness
grim really,sadness
loyal heart is concerned somber,sadness
has providing customers w equipment that does not deliver speeds of internet services that they have been charging unhappy scam,sadness
yes too many cops and too many ppl who should have lost their lives r still alive,sadness
you find me lost will you stay as a passerby or will you get lost with me musings melancholy,sadness
getting use to not having a phone it is sad,sadness
slugging vitamin d pills by the handful like they were m amp ms when will this eternal winter end melbourne grim overit,sadness
the support network is causing the damage n n support damaged alone tired hurt nojustice surivivor nomore,sadness
sadly this sort of poster died by the afaik,sadness
sadly not one less hour drinking time,sadness
was in the dark room for minutes and failed every time i tried developing a photo i am so frustrated with myself,sadness
emotions sadness anxietymaybe missingfriends growingupsucks lostfriends wheresthetruefriends complications,sadness
thank you i shall mourn her,sadness
that yearly transition from excited and hopeful college returner to sick and exhausted pessimist college,sadness
but this is no easy ride for a child cries n oh find me find me nothing more nwe are on a sullen misty moor,sadness
to give my afam son this advice today be polite no sudden movements keep hands where they can see them sadness,sadness
southampton will wipe the floor with west ham on sunday so disheartened,sadness
quite simply the worst airline worstairline i have ever used shocking appauling dire dismal beyondajoke useless,sadness
knowing i have to get up at half for gym in the morning it is so depressing,sadness
tried get earlier flt bwi turnd away bcuz it was late then agent let other pas on silvereliteleftbehind unhappy,sadness
all the ex united managers on twitter who form our fanbase honestly i despair at times just back the fucking team eh mufc,sadness
we go back weeks and start again this is seriously dreadful,sadness
honestly upset that they rewarded nicole depressing paulwasrobbed rewardhardwork bitterjury,sadness
have not watched my favorite youtubers in months and it is honestly made my depression so much worse,sadness
endtrumpweek please it is depressing me,sadness
i think sadness is felt very strongly physically and mentally it feels like it takes over and it is hard to focus at work mhchat,sadness
it is old sadly,sadness
sadly not,sadness
tulsa the man onthe helicopter said he looks like a bad dude that is the problem when they see black they see bad sad,sadness
some do not see the difference between courting and appealing to a women vs deception amp pressure it is depressing,sadness
way too hard not to get discouraged,sadness
a very depressed and suicidal person seeing someone sing about their own depressing life yet having fun is very relatable and encouraging,sadness
returned from the dead with a desire to clean the apartment and eat something that is not garbage managing depression,sadness
poor service tonight to find season ticket holders in the seats we purchased online forced to move further away unhappy,sadness
a pencil never stayed with me until it is end,sadness
gutted i dropped one of my earrings down the sink at school,sadness
holiday blues wanttogobacktominehead,sadness
rather die alone then end up with somebody who can not be sober,sadness
do not think it is fully sunk in that val is gone yet,sadness
being sober so i popped two,sadness
pretty clear i can not stand hillaryclinton no tolerance for habitual liars not a trump fan either so what is a citizen to do despair,sadness
hard to tell in your pic my mistake then either way nothing i said initially was about race u took it there sad ignorant,sadness
n momentarily before it disappeared only solemnity and anxiety lacing his features n n i ran out to get you before,sadness
the juniors are now wearing purple at ollafest while i am here fighting with my alarm about when i need to wake up for german sadness,sadness
fact i have not had to wear a bra for a week and knowing i will have to start wearing one again after tomorrow is depressing,sadness
is too distant makes me mourn,sadness
now september and we are still battling a situation that was said to be handled march of this year att this is unacceptable,sadness
weather got me fucked up like you either be sunny and hot or gloomy and cold no in between,sadness
why do i have wait hours to call you back to cancel an order i just placed after already spending hours on the phone sad,sadness
is too short so dont shoot it in with worries sadness and grief,sadness
going to sulk in bed until friday,sadness
nooooooooooooooooooooo we have stupid dismal lame winters where we maybe get some dangerous ice once,sadness
i could have seen her at a local mall or any school football games im disheartened,sadness
great programme tonight sad upsetting extremeworld,sadness
friends tell me i am pretty trigger tells my i am ugly i first was confused but then realised i am both pretty ugly tru sad tumblr,sadness
when my mom told me yesterday that it was looking grim and i started driving out there i was told to turn around b c she was too sick,sadness
the whole it is been hijacked argument the same argument used to ban or discourage the display of the st george is cross shame lbc,sadness
do not want the pity of my instructors but i would like some understanding i am truly trying despite all circumstances that make me discouraged,sadness
mhchat childhood experiences inform adult relationships we have associative memories not a question of ability to process sadness,sadness
payet goes either in jan or the seasons end can not say i blame him the boy must b so disheartened by what he is seeing at the mo,sadness
can not cope wi her sour face and tiny pout,sadness
many things i do not care about and many things i do that i do not speak on because it is such a heaviness even when released,sadness
has providing customers w equipment that does not deliver speeds of internet services that they have been charging scam,sadness
flirt simper pout repeat yuck,sadness
bc it is a gloomy day tony,sadness
my heart actually sunk looooool i was so confused,sadness
eable it is ms btw we were lied to by remain dry your remainer tears just accept you lost,sadness
cant stop i finished dejected luckily no one is in the bathroom so i go to a stall and wait until my pants are dry,sadness
wonder what would happen if i were a father weary,sadness
this is so absurd i could laugh right now if i also did not feel like crying for the future of our country despair wakeupcall,sadness
i could not get on with it either bits started drooping that should not droop gp said mooncup alone to blame,sadness
it happens and vegas is not the only origin thats prevelant sadly,sadness
just have to eat my way to sobriety this will be a hell of a journey back to sober,sadness
you have doe run the opposite side of you,sadness
noh i am sorry about it do not be sad yourself there is nothing important in the world to grieve about it,sadness
of failure of delivery on time a customer has to pay rupees more not good tiagotatamotors tatamotors unhappy,sadness
sterushton genuinely grim stuff over a century of history sold off by some porn baron twats for a minty new stadium urgh,sadness
sad when your man leaves work a little bit late and your worst fear is oh no did he get stopped by the police ourworld,sadness
at least in crystal every part of it is portrayed as being wrong the dark atmosphere the fact that mamoru is brainwashed,sadness
too cool to die young way too young to die sober tunechi,sadness
daraidernation erockhd take out of it the numbers on madden are low and have dropped and people are unhappy,sadness
have no clue where my charger is lost,sadness
this is the most grim piece of laughter i was stricken with all day,sadness
moving clips on youtube tonight of the vigil held at tulsa metropolitan baptist church for terencecruther justice anger sadness,sadness
a nail half hanging off is absolutely fucking grim even with my acrylic holding it on,sadness
geelong football team nlast seen entering through the banner not sure where they have been since unhappy playwithsomeheart,sadness
always unhappy and easily offended,sadness
a sad day of fall i do not dislike fall i just love summer firstdayoffall goodbyesummer sadness bathingsuitsforever,sadness
i am not there yet has not sunk in yet rest up,sadness
of time is awareness of time lost awareness time lost,sadness
i frown and cup your cheeks in my hands after you step aside angela i care about you and i do not know how else i can,sadness
be a loooooong year as a browns fan longer than normal and that is sad,sadness
david milloy ni like your thinking but sadly no that is the shed,sadness
the sadness leaves you broken in your bed i will hold you in the depths of your despair and it is all in the name of love,sadness
substituted the hood for a badge and gun public opinion is indictment of charlotte police dark sadtimes america race,sadness
doing the exact same minus the beer sadly,sadness
miss the guy who always make me sulk,sadness
us not burden our remembrances with a heaviness that is gone n william shakespeare ahead,sadness
fail or pass i refuse to be sober,sadness
why did they want to make you plummet in to the depths of despair,sadness
donlemon trump presidency a dark age for the usa and the world he would most definitely take us to war short amp long term pain,sadness
unbelievably discouraged with music as of late incredibly behind on completing my album not digging this at all,sadness
dreadful mutch is he even on the pitch fryers out of his depth unfortunately cpfc,sadness
you are unhappy with someone just fucking tell them you are unhappy and leave do not go fuckin around with other people on the side,sadness
reports on mama ritamarley health mannn and i woke up today feeling like mi ole self rejoice now dis sadness,sadness
can you blame the manager watching these players play it is abysmal our team are dreadful if jose can not save us no one can mufc,sadness
sorrow is grim reminder of how bad i can be at video games and how i could get a bit too trigger happy at times rip,sadness
kind of confused the one thing i do right now has a great future but on the other hand so does the new thing lost needhelp,sadness
ckolacia msm relentlessly saying dt can not win to depress gop turnout amp provide cover stolen election,sadness
voice is all about miley and alicia this year no longer about the contestants sad thevoice,sadness
i have this one so i am not so sad but wtf,sadness
i may be an sufc fan and the football maybe shit but marcos rojo for mufc has had a shocking start he is just dreadful,sadness
