text,label
simply dream big be grateful give love laugh lots unknown quote inspiration happy,joy
happy be bright be you identity timelesstips friendship family forest water family truelove god roadsofar you lifetrip,joy
you wake up from a dream laughing at something stupid and that makes you laugh more,joy
i love parody accounts well done vote for trump lol,joy
he surely is rejoicing over us with singing such romance and so needed today,joy
happy bday bro,joy
happy birthday have a blessed day love from toronto bday smile,joy
the thing i get excited about in my profession are mad a client said she opened her bowels i am rejoicing,joy
dumb ass hell lolol hilarious lethalweapon,joy
positive cheerful grateful and expectant nightingaleearl success leadership,joy
are elated to have lisavol sid espinosa and dyuliharris ready to inspire innovative students knightfdn microsoftsv jessicaweare,joy
it is hilarious,joy
not that the man did not know how to juggle he just did not have the balls to do it n funny pun punny lol,joy
just go outside or to the gym hall and play n education learning,joy
by the way takeru is eyes sparkling while eating was like the cutest thing ever,joy
satisfy us early with thy mercy that we may rejoice amp be glad all our days ps gladness joy,joy
it makes complete sense and i am elated to hear this,joy
yeah playing well,joy
lmaoo it will be a joyful day,joy
you rachelplatten for teaching me how to live again it is been so long since amp this ride is about to be exhilarating i just know it,joy
of listening to the sound of the chopper working it is way closer to home at mountaindairy makes me happy,joy
rosatrunk iam spl nga have a joyful day,joy
this v overtime in hockey got me sweaty damn this ish exhilarating,joy
an exhilarating last minute of overtime,joy
and i am elated because i am taking pto tomorrow so i am doneeeee but,joy
hygge candles jasmine tea amp gbbo,joy
when u ride on a pile of salt life is extra sweet always salty always savory surfing aloha smiling,joy
a beautiful day today cloudy but sunny and breezy,joy
guitar shop owners everywhere rejoice,joy
joyous first webiversary web mitzvah to smithsonian is weipoints brianwolly jackie mansky bethpylieberman bilbo mazeltov,joy
may i send you a copy of herothegreyhound either e book or real paper one a boy and a greyhound smiles tears laughter,joy
forward to the detours because they bring delightful surprises lifequote,joy
looking back on recent tweets seen this one right here is great perfect speechless deal,joy
cable hooked up in new place just in time for nbcchicagopd and nbcchicagomed premiers is like god smiling down on me onechicago,joy
thenewshour lodhimaleeha ndtv indiatoday this is hilarious not a freudian slip eh,joy
this amazing live ly broadcast by musically,joy
siblings look all gangster amp i look all cheery,joy
uff look at your arsenal fans cheering for every goal against united haha,joy
sylvia was elated to receive kisses from the little prince her bright smile clear as she glanced to garrett and elyse,joy
is something v satisfying about opening an old noto do doc file and being able to check off all the things you have done smiling,joy
you have the ability to make someone happy or to make someone smile do it the world needs more of that right about now createlove,joy
i am fine on the near future i just want to go to bed super elated and put together audio compilations of great moments,joy
to go hit up the library i have a lovely pile of book reservations to collect this morning glee books reading,joy
you ai not watching sugarboy on hulu then you ai not shit hilarious hahaha,joy
i cried with laughter,joy
due for a big change i have prayed on it i think i deserve it positivity optimism,joy
totes had to re listen to the endless hilarity that was tom odell is raaar this morning grimmers fionaradio tinadaheley,joy
finally raining in ashland oregon we have been parched all summer amp fall the plants amp people are rejoicing,joy
you are en route to your future hucjir i am coming for ya openhouse futurecantor exhilarating nycletsgo,joy
you got this staystrong smile yourebeautiful,joy
thursday which means it is grey is day tgit,joy
this amazing live ly broadcast by brooke bridges musically,joy
current run of superman continues to be a delight you can feel the love poured into it by everone on the creative team superman,joy
am always ready to smile,joy
at night has got to be one of the most exhilarating refreshing things i have ever done,joy
using my nephew for meme hilarious,joy
blew up the internet with his chirp lol love it,joy
about trying some comedy on youtube always been fond of it time to nut up laughter comedy maybeoneday hopefullyfunny lol,joy
like talking to someone who makes me laugh laughter is the best medicine,joy
using my nephew for meme,joy
bethenny independence msg on wendywilliams be happy amp fulfilled within yourself amp positivity will flock to you happy independent,joy
this amazing live ly broadcast by katyy mae lively musically,joy
is a gift that is why it is called the present happiness optimism entrepreneur personaldevelopment,joy
ur class at least once in your life time cuz later when u look back good marks will not make u happy but memories will apj,joy
lydiajanef i wish i really truly wish that i had just a modicum of your banter hilarious,joy
i watching bacheloretteau or zoolander hilarious samvrhys,joy
yup and val basically ignoring the recipe i am just done i keep bursting into laughter x,joy
happy not because everything is good but because you can see the good side of everything optimism,joy
fact everyone is selling their kanye tickets or are buying them for less than is unbelievably hilarious to me,joy
sweet,joy
showed us a really lively performance with a lot of different emotions not just sticking to one and that is freaking awesome,joy
i will be there can not wait for all the mirth,joy
is pochama nhe is very cute and easily elated,joy
my adorable and cheerful daughter nalways pouring positivity green goo on me ndare hurt her and you will see hell growls n n pandabot,joy
the life you have is a blessing for god make it a joyful experience regardless of the odds gby,joy
brings back great memories of hilarity on saturdaynightlive,joy
neighbor dancing in the clayton homes commercial is me hilarious,joy
in all a pleasing night down the lane on to the next round amp bring on liverpool at anfield coys,joy
jetswhispers be sure and switch it over to cable news cheery,joy
you simply act out of kindness strength and optimism today will be the best day ever tarleton kine drkaylapeak,joy
johnmurrays you are welcome it is genuinely made me give my head a wobble and realise what is important in life smiling,joy
yeah playing well optimism,joy
have i only just started watching glee this week i am now addicted glee gleek,joy
nhl watching the jubilant scrum at the end of the day and remembering they are all still kids priceless,joy
chirp what a beautiful white and red bird,joy
minutes of yoga to your breakfast routine will change your day preparation sunriseyoga bodyawareness health yoga smile stretch,joy
cheer cheer the red and white we are now off to grand final to win the fight thanks jetstarairways,joy
not that the man did not know how to juggle he just did not have the balls to do it n funny pun lol punny,joy
this amazing live ly broadcast by iamjustinburke lively musically,joy
she let out a playful gasp and slowly wrapped her arms around his neck kissing him back,joy
t i shawty lo beef is one of the more underrated ones in hip hop history chock full of wit bravado and hilarity,joy
popped a half bottle of bellawines sparkling gamaynoir from westbank evenin folks n bcwinechat,joy
i am outside making beats with garageband and some little birds decided to chirp along,joy
follow me on musically i am making a lively come and join bffing and following see you there,joy
i like your optimism,joy
gosling and eva mendes finally b joyful an funny dont boss dont argue do everything with kids go on mini car trips focus on love,joy
just replaced my sadness with laughter can not go the whole day sad,joy
hearty welcome to those who followed me,joy
ever use to like smiling until i realized how good my teeth look witout the braces,joy
airbnb another happy customer secreteyes,joy
just heard the most incredibly transcendent song ever amp now i feel high amp fucked up yet joyful amp i will never be the same,joy
she laughed so little known all over every body at the brilliant cheerfulness of sweetmeats and a fashion,joy
geo is capable of cheering me up,joy
aww i had a maine coon when i was little named ted eddy the wonder cat they are such good cats very playful and sweet,joy
someone happy,joy
if the metro lrt went over the walterdale yeg,joy
follow beautiful snowgang princess fitness bodyposi haircut smile whitegirlwednesday,joy
a bit shit getting a very high blood sugar then i remembered it is my first one above this week which is incredible for me happy,joy
sargon of akkad this is too much hilarity for one day,joy
a veteran just totally got me out of a ticket i am elated right now close call,joy
screams at the four winds we aint ever getting older cute jovial rhythm starts moves hips along and waves arms in the air,joy
not that the man did not know how to juggle he just did not have the balls to do it n funny pun punny lol,joy
is something v satisfying about opening an old noto do doc file and being able to check off all the things you have done,joy
is so bad it is hilarious,joy
due for a big change i have prayed on it i think i deserve it positivity,joy
this amazing live ly broadcast by kaylaaa sartorious lively musically,joy
i hope you never go a day without something to make you smile you deserve all good things please follow,joy
it is ok champ you will make it i am cheering you on from a far,joy
is hilarious,joy
so playful lol i need somebody that will joke with me all day long cause ill never get tired of it,joy
miss cookie sends her thanks she is not as spry as she used to be like me she does not have the adventures the young pups do,joy
better to be wetter than it is dry certainly found that hilarious gbbo,joy
not that the man did not know how to juggle he just did not have the balls to do it n funny pun punny lol,joy
hygge candles jasmine tea amp gbbo happy,joy
aaa cam animated that so proud of our boy,joy
but it is so aesthetically pleasing omg,joy
quote soup be happy not because everything is good but because you can see the good side of everything,joy
is aesthetically pleasing to look at,joy
bethenny independence msg on wendywilliams be happy amp fulfilled within yourself amp positivity will flock to you independent,joy
thought i got mad for anything but my bf gets mad over any little thing lmfao shit be hilarious,joy
it is exhilarating,joy
happy my next class is canceled bc im od tired,joy
leads to success bill kerr coach kerr success goals,joy
meant to be,joy
is the respect we give everyone,joy
untill today has anyone ever said to me they remember what i had on over years ago when they met me n liked me since cutealert happy,joy
object of literature is to make man a wiser and happier being the poet makes us happy because he tells us how we may become so,joy
avatar and wondering why i took so long to watch this collapses in a joyous heap,joy
at the risk of being blocked i thought that video from the wake was hilarious,joy
want the smoky clouds of laughter to swim about you forever more,joy
a cheery ghost,joy
this amazing live ly broadcast by lively musically,joy
this amazing live ly broadcast by lively musically,joy
this amazing live ly broadcast by maisiev musically,joy
i know they have you a scripted ego maniac but i was so elated to hear that you are a devout christian like myself phenomanal,joy
i really wish i could attend the show at rcmh i am there in spirit cheering you and the dudes on,joy
try asking for a cheeseburger with only onion amp mustard at any mcdonalds hilarious,joy
the challenges so that you can feel the exhilaration of victory motivation motivationalquotes quoteoftheday,joy
this amazing live ly broadcast by flydudern musically,joy
know what is great about gbbo contestants helping each other cheering each other on so important,joy
the challenges so that you can feel the exhilaration of victory,joy
hello miss lady i am sure today brings you happiness and laughter use your voice also to make us laugh god knows we need it,joy
you twitter for the balloons today goodday,joy
wagging his tail at the praise he paused tilting his head as she took the frisbee from him letting out a playful,joy
is merriment together with sevylor inflatable kayaks eyggjxml,joy
how to cook is invaluable what is even better is that even in a sq ft place i have wide and hearty homestyle egg noodles,joy
this amazing live ly broadcast by musically,joy
what makes you successful and happy now and forever,joy
love mary is undying optimism you could present her with dog shite and she would find something good to say gbbo,joy
your smile to change the world do not let the world change your smile quote actorslife smile love hardworkpaysoff fun,joy
every morning to a positive head start with your clients relations,joy
awosss listen i d not subscribe to this team coq team xhaka stuff i like all our players depth has me elated,joy
this amazing live ly broadcast by hannah mccloud lively musically,joy
the weather so breezy man why can not life always be this easy,joy
cheerfulness or a good temper the more it is spent the more of it remains,joy
this amazing live ly broadcast by mrgummyking lively musically,joy
this amazing live ly broadcast by rosannahill lively musically,joy
call from haitian church we started in florida some ago preparing to acquire their own bldg wanted me to know rejoicing,joy
a specific joyous song title engiybhekayo yasezayoni need it for le mood,joy
of restoration to the nation of israel everywhere you look blessing barns wine overflow everything beautiful do u see,joy
forward to the detours because they bring delightful surprises lifequote delight,joy
this amazing live ly broadcast by paulzimmer lively musically,joy
about a mood pickup i went from depressed to elated so fast,joy
singing can not fight this feeling in the shower and will spying on him is one of the best scenes on any show,joy
i am cheering for teamna wch and teameur wch nhlnycsweepstakes,joy
this amazing live ly broadcast by evanhufferd lively musically,joy
sweet optimism,joy
singing can not fight this feeling in the shower and will spying on him is one of the best scenes on any show glee,joy
you are en route to your future hucjir i am coming for ya openhouse futurecantor nycletsgo,joy
thursday which means it is grey is day tgit rejoice,joy
this amazing live ly broadcast by kana blender musically,joy
glad you gained some cheery vibes just by looking at our happy meal,joy
found marmite in australia,joy
this amazing live ly broadcast by huntermcaseyy musically,joy
aside from that i am all about pleasing the individual that i am involved with my pleasure comes from their pleasure,joy
tiburonchamber plus a hearty pour of yachtrock by mustacheharbor,joy
any team in the world would be totally elated to get to have you on it xd,joy
my top delight was a skein of geese flying about foot above me as i swam in windermere breeze dropped amp it became like glass,joy
to reveal a broad smile n n yeah it is nice n npursing his lips he stifled his joyous expression in order n n aviataube,joy
lord turn his face toward you and give you peace numbers truth trust promise calm justice great mighty protected delight,joy
this amazing live ly broadcast by its finfin lively musically,joy
this amazing live ly broadcast by iamjustinburke musically,joy
what a happy looking couple,joy
king is back paedeezy bright city lights,joy
my kinda girl pleasing the dick right,joy
channel is at the height technics hearty enjoyment symptomatize vrlfeyrn,joy
this amazing live ly broadcast by maisiev lively musically,joy
fingers slide along your thighs caressing the skin before she is leaning down down down and the first lick is teasing n playful,joy
i was just introducing a little levity to the convo yep,joy
oh please inc talking about looting i am not saying bjp is pure but this is such a hilarious irony is def better,joy
a moment i found myself smiling,joy
wouldrunken patroons make this whole situation much more jovial though,joy
this amazing live ly broadcast by flydudern lively musically,joy
her cheerful voice echoed through the grand familiar home a smile blossoming on my rosy brims amom i reciprocated the,joy
watched django unchained other people may frown but i titter in delight,joy
future must be bright af,joy
gave a playful wink taking the goggles off her head swinging them around her finger i would never verminengineer,joy
this amazing live ly broadcast by musically,joy
simply dream big be grateful give love laugh lots unknown quote inspiration,joy
the bright side my music theory teacher just pocket dabbed and said i know what is hip and walked away,joy
this amazing live ly broadcast by paulzimmer musically,joy
trust me dear if you want to make anything invisible hang a wet paint on it and hilarity will ensue,joy
this amazing live ly broadcast by swagrman fan musically,joy
wise egypt offers great places amazing scenery bright skies and good weather at a very good and affordable price for students,joy
hit up breezy every day to make sure he is breaking in my boots first class friend right there,joy
this amazing live ly broadcast by kaylaaa sartorious musically,joy
minutes of yoga to your breakfast routine will change your day preparation sunriseyoga bodyawareness health yoga stretch,joy
this amazing live ly broadcast by jaredhorgan musically,joy
be happy not because everything is good but because you can see the good side of everything optimism,joy
single problem we ever face can be solved with a nice blend patience and optimism,joy
to a new job is hard when you have nothing but joyful memories of the previous one thanks lifeteen for changing my life,joy
the challenges so that you may feel the exhilaration of victory n ntomiho ipaglabanmo,joy
n nother begin telling a istory he realized that she was making an attempt at cheering him up it was sweet of her and so,joy
to go hit up the library i have a lovely pile of book reservations to collect this morning books reading,joy
untill today has anyone ever said to me they remember what i had on over years ago when they met me n liked me since cutealert,joy
is no coincidence that lacan recorded infants jubilant reactions to their mirror images in the noise,joy
happy be who you want to be if others do not like it then let them be happiness is a choice life is not about pleasing everybody,joy
the challenges so that you can feel the exhilaration of victory,joy
joyful encounter in tribez amp castlez i just met mouchole ogre cook do you want to know who that is download the game and find,joy
did it not just enliven your soul,joy
non permissive environment is also called a battleground milspeak hilarious,joy
fancy i have some of those and i have never put them up i should do that also i vote jaunty angles then no one will judge,joy
i keep a down vest or sweater in my pack year round helps on chilly mornings or breezy mountain tops mysportinglife,joy
not had much to cheer about you see,joy
this amazing live ly broadcast by musically,joy
not that the man did not know how to juggle he just did not have the balls to do it n funny pun punny lol hilarious,joy
annual reminder that i do not care and will cheerfully eat anything so labeled,joy
this amazing live ly broadcast by huntermcaseyy lively musically,joy
wrinkling up well now looks here like your name starts with the letter g eh the man smiled up and gave a hearty,joy
this amazing live ly broadcast by lively musically,joy
yes bro it is actually breezy,joy
the fu k who the heck moved my fridge should i knock the landlord door angry mad,anger
my indian uber driver just called someone the n word if i was not in a moving vehicle i would have jumped out disgusted,anger
i asked for my parcel to be delivered to a pick up store not my address fuming poorcustomerservice,anger
ef whichever butt wipe pulled the fire alarm in davis bc i was sound asleep pissed angry upset tired sad tired hangry,anger
join btcare they put the phone down on you talk over you and are rude taking money out of my acc willynilly fuming,anger
blood is boiling,anger
you have still got a whole season of wentworth to watch and a stupid cunt in work ruins it for us kirstyga raging oldcunt,anger
why does tracking show my equipment delivered when it was not why is my service suddenly delayed we have already weeks fuming,anger
legit why i am so furious with him people are such fucking idiots,anger
is it suppose to work if you do that wtf dude thanks for pissing me off,anger
so mad about power rangers im incensed im furious,anger
use using mothercareuk mothercarehelp again these guys cant get nothing right fuming,anger
aggravate like what inspires you to be the biggest cunt known to man kind,anger
does dapperlaughs have to come to glasgow on a night i am working i am fucking gutted been waiting for an appearance for ages raging,anger
fuming,anger
help from ups customer service just pushing the buck back and forth and promising callbacks that don t happen anger loathing,anger
not to mention the gra guy stops me but let is the ppl in front of me go wtf my blood is boiling,anger
hate my lawn mower if it had a soul i would condemn it to the fiery pits of hell,anger
are people so offended by kendall he ends photo shoot like seriously shut the fuck up,anger
about to block everyone everywhere posting about the storm i think everyone is aware of the damn rain and what not so quit damn,anger
my buddy cry bitch wait for revenge,anger
you do not just tell a true blooded hoopjunkie to switch a f c n team that juz destroyed your own team you juz do not insult,anger
got a no response again from an irate customer of amazon nwhy can not they understand that it is not always amazon fault n carrierfault,anger
immobilize if you taser someone why the fuck do you need to shoot them one second later this is really sick rage wtf murder,anger
mistaaggy giovanniidc the way my blood is boiling little bastards,anger
fuming i have nothing to wear saturday,anger
than straight people even the arse straight guys who think that means a threesome is fine angry fuming,anger
parking ticket fuming,anger
ever just find that the people around you really irritate you sometimes that is me right now,anger
get so angry at people that do not know that you do not have a stop sign on francis and you do at foster road,anger
fuck you is boiling up inside its not gonna be good when i let it out,anger
vodafoneuk wow my bill is and hav a text from u to prove that and you have taken swines fuming con,anger
blame the whole season on natalie the season would have been so different had she not turned her back on her alliance pissed,anger
the update my iphone loses power nearly faster furious,anger
i am about to fly into a fit of rage it is not fair,anger
takes minutes to get through to barclaysuk then there is a fault and the call hangs up fuming treatcustomersfairly,anger
susansarandon we are blaming of the fucking idiots who are putting the world in the middle of their tantrums you are one,anger
you people infuriate me,anger
mine is that the party did decide but the party has been slowly transformed into a vengeful hell cult of white male resentment,anger
angry about my wishshopping order months ago i placed an order of over card billed never received n disappointing,anger
can not log into my fucking snapchat snapchat snap,anger
sam yes we have not helpful at all we need this sorting asap you keep promising stuff that does not happen fuming,anger
let snakes in my house i bet it ya boi huck i kill that bugger when i get my hands on him rage,anger
ef whichever butt wipe pulled the fire alarm in davis bc i was sound asleep pissed upset tired sad tired hangry,anger
does dapperlaughs have to come to glasgow on a night i am working i am fucking gutted been waiting for an appearance for ages,anger
feel furious,anger
mexican ladies irritate the fuck outta me have a their own lil preschool of fucking kids for the welfare amp allllat smh,anger
can not log into my fucking snapchat snapchat,anger
blame the whole season on natalie the season would have been so different had she not turned her back on her alliance pissed bitter,anger
irritate my mf soul,anger
so angry,anger
fuckin irritate me,anger
you are a cruel cruel man therewillbeblood revenge,anger
way ur so angry you can literally feel ur blood boiling,anger
this amount of greedy mooching makes me snarl,anger
mind is raging and i just want to end it all,anger
fuming that some woman jumped into my prebooked taxi and drove off,anger
nothing but a hateful and bitter fag,anger
something needs to be done about people hogging machines nobody can use machines at one time angry notfair whypay,anger
ikr people still got a grudge against him for no reason like wtf,anger
then he said talking about wills uncontrollable animals when moving to another link these comments do not help fuming,anger
ee bad news if ordered online it has not gone through same happened to me had to re order on the phone furious,anger
angry i wanna cry,anger
my god uuuugggghhhhhhhhh,anger
dunkindonuts till butter pecan comes back i am furious,anger
black people are still fighting to be recognized as human beings cantsleep angry,anger
mom cut my phone off and i am so furious,anger
again the only thing on my feed is naay raging about something and my brother filling in all the gaps,anger
believe achilles killed me angry,anger
lost a couple niggas i want revenge so put me in coach,anger
